source,title,author,date,content,topic,clean_content,sentences,tokenized_sentences
동아일보,어디로갔나 5백여 재비교포,,1964.12.04,이렇듯 한국인에 대한 보복이 취해진 원인은 「필리핀」 에서 끝까지 항전한 일본군이 나남사단이라는 일본 제19사단이었기 때문에 「필리핀」 인들은 이사단병력이 모두 한국인으로 오인한데 있었을것이라 교포들은 말하고 있는데 종전후 별도수용된 5백여 한국인 전범은 그 뒤 소식이 오늘날까지 감감하다. 이들이 처형당했는지 또는 석방되어 귀국했는지는 기록이 없으나 종전 전에 1천 명을 헤아리던 우리 교포 중 현재 살아남은 교포가 겨우 5명이라는 사실이 어떤 시를 주고있는 것 같으나 이 5명의 교포는 그 때의 비극을 되씹기가 싫다고 굳게 입을 다물고 처형된 홍사익 중장이 한국인이라는 사실이 알려지기조차 꺼리고 있었다.,"한국인 전범, 필리핀, 재비교포",이렇듯 한국인에 대한 보복이 취해진 원인은 필리핀 에서 끝까지 항전한 일본군이 나남사단이라는 일본 제19사단이었기 때문에 필리핀 인들은 이사단병력이 모두 한국인으로 오인한데 있었을것이라 교포들은 말하고 있는데 종전후 별도수용된 5백여 한국인 전범은 그 뒤 소식이 오늘날까지 감감하다. 이들이 처형당했는지 또는 석방되어 귀국했는지는 기록이 없으나 종전 전에 1천 명을 헤아리던 우리 교포 중 현재 살아남은 교포가 겨우 5명이라는 사실이 어떤 시를 주고있는 것 같으나 이 5명의 교포는 그 때의 비극을 되씹기가 싫다고 굳게 입을 다물고 처형된 홍사익 중장이 한국인이라는 사실이 알려지기조차 꺼리고 있었다.,"이렇듯 한국인에 대한 보복이 취해진 원인은 필리핀 에서 끝까지 항전한 일본군이 나남사단이라는 일본 제19사단이었기 때문에 필리핀 인들은 이사단병력이 모두 한국인으로 오인한데 있었을것이라 교포들은 말하고 있는데 종전후 별도수용된 5백여 한국인 전범은 그 뒤 소식이 오늘날까지 감감하다.
이들이 처형당했는지 또는 석방되어 귀국했는지는 기록이 없으나 종전 전에 1천 명을 헤아리던 우리 교포 중 현재 살아남은 교포가 겨우 5명이라는 사실이 어떤 시를 주고있는 것 같으나 이 5명의 교포는 그 때의 비극을 되씹기가 싫다고 굳게 입을 다물고 처형된 홍사익 중장이 한국인이라는 사실이 알려지기조차 꺼리고 있었다.","이렇듯 한국인 대한 보복 해진 원인 필리핀 까지 항전 일본군 나남 사단 이라는 일본 19 사단 이었기 때문 필리핀 병력 모두 한국인 오인한데 있었을것이라 교포 하고 있는데 종전 별도 수용 백여 한국인 전범 소식 오늘날 까지 감감하다
처형 당했는지 또는 석방 되어 귀국 했는지는 기록 없으나 종전 1천 헤아리던 우리 교포 현재 살아남은 교포 겨우 이라는 사실 어떤 시를 주고있는 같으나 명의 교포 비극 되씹 싫다고 굳게 다물고 처형 홍사익 중장 한국인 이라는 사실 알려 지기 조차 꺼리고 있었다"
경향신문,전쟁은 비극,,1966-02-18,백발의 노구에도 카메라 앞에선 부동자세를 취하며 서릿발같이 굳은 표정을 지었다. 이날 공항에는 시오자와씨와 일본 육사와 육군대학 동기 동창이며 필리핀에서 전범으로 몰려 사형당한 홍사익 중장의 맏아들 국선씨가 마중 나왔었는데 얼싸안고 울었다.,"홍사익, 전범, 가족",백발의 노구에도 카메라 앞에선 부동자세를 취하며 서릿발같이 굳은 표정을 지었다. 이날 공항에는 시오자와씨와 일본 육사와 육군대학 동기 동창이며 필리핀에서 전범으로 몰려 사형당한 홍사익 중장의 맏아들 국선씨가 마중 나왔었는데 얼싸안고 울었다.,"백발의 노구에도 카메라 앞에선 부동자세를 취하며 서릿발같이 굳은 표정을 지었다.
이날 공항에는 시오자와씨와 일본 육사와 육군대학 동기 동창이며 필리핀에서 전범으로 몰려 사형당한 홍사익 중장의 맏아들 국선씨가 마중 나왔었는데 얼싸안고 울었다.","백발 노구 에도 카메라 에선 부동 자세 취하 서릿발 같이 굳은 표정 지었다
공항 에는 오자 일본 육사 육군 대학 동기 동창 이며 필리핀 전범 몰려 사형 홍사익 중장 맏아들 국선 마중 나왔었는데 얼싸안고 울었다"
조선일보,눈물흘린 「왕년의 전범」,,1966-02-18,"시오자와 씨는 이날 전 경성일보사장 중보흥작(70)씨, 일본 향우연맹 부회장 세천량일씨 등과 같이 한국재향군인회 초청으로 한국을방문한것.「시오자와」 씨는 일본 육군중장이며 남방군 「필리핀」 주둔사령관으로 복역하다 전범으로 사형당한 홍사익씨와 육사동기며 가장 친숙한 사이였다고. 이날 그를 마중나온 고 홍장군의 맏아들 홍국선씨를보자 와락껴안 고눈물을흘리기도.","홍사익, 전범, 가족","시오자와 씨는 이날 전 경성일보사장 중보흥작 70 씨, 일본 향우연맹 부회장 세천량일씨 등과 같이 한국재향군인회 초청으로 한국을방문한것. 시오자와 씨는 일본 육군중장이며 남방군 필리핀 주둔사령관으로 복역하다 전범으로 사형당한 홍사익씨와 육사동기며 가장 친숙한 사이였다고. 이날 그를 마중나온 고 홍장군의 맏아들 홍국선씨를보자 와락껴안 고눈물을흘리기도.","시오자와 씨는 이날 전 경성일보사장 중보흥작 70 씨, 일본 향우연맹 부회장 세천량일씨 등과 같이 한국재향군인회 초청으로 한국을방문한것.
시오자와 씨는 일본 육군중장이며 남방군 필리핀 주둔사령관으로 복역하다 전범으로 사형당한 홍사익씨와 육사동기며 가장 친숙한 사이였다고.
이날 그를 마중나온 고 홍장군의 맏아들 홍국선씨를보자 와락껴안 고눈물을흘리기도.","오자 경성일보 사장 보흥 70 일본 향우 연맹 부회장 같이 한국 재향군인회 초청 한국 방문
오자 일본 군중 장이 남방군 필리핀 주둔 사령관 복역 하다 전범 사형 홍사익 동기 가장 친숙한 사이였다고
마중 나온 장군 맏아들 홍국 선씨 보자 와락 껴안 눈물 흘리 기도"
중앙일보,한국인 전범 처형자의 비,강범석,1967-02-20,【동경=강범석 특파원】제2차 대전의 전범자로 처형된 한국·대만 출신자 49명의 영혼을 달래기 위한 위령비가 오는 4월 초순 「교도」시 「히가시야마」 「고다이지」 경내에 세워지게 되었다. 이 위령비의 건립을 위해 사뭇 애써온 일본 문화 연합회 대표 「고미야마·노보루」(53·동경도 세전곡구 송원정 1의 13의 9)씨는 『일본 때문에 억울한 목숨을 잃은 사람의 명복을 비는 것은 바로 일본 사람의 의무』라는 신념으로 10여 년 동안 이 사업을 추진해 왔다. 1950년이래 「전범 역류자 해방운동 협력회」를 조직 전범자들의 조기 석방운동을 벌여왔던 「고미야마」씨는 57년도 의외에도 전범 처형자들 중에 한국인 출신자가 23명 대만 출신자가 26명이나 끼어 있음을 알아내고 이들 49명의 위패를 만들어 그해 4월 1일 「교도시」의 영산관음에 안치했다. 이때부터 그는 다시 위령비의 건립을 기도했다. 그는 처형자의신원과 이력을 조사하고 그들이 남긴 유서를 모았다. 위령비의 대좌에는 그 자신 「마가반야파라밀다심경」의 사경 1백권을 헌납키로 결심 2년째 걸려 사경을 모두 썼다. 이를 감은 권지는 무려 1백20「미터」. 49명의 각 위에는 될 수 있는 한 각자의 신분에 따라 불교·유교·기독교 그 밖의 경문·성구 혹은 자작시·헌영가를 구절마다 필사로 새겨 명복을 비는 마음을 한층 간절하게 했다. 이들 중 몇몇은 그들이 남긴 유서에서 전쟁의 비극 터질 듯한 민족의 울분 저주스러운 인간의 슬픔 등을 말해 주고 있어 눈물겨웠다. 1947년 2월 25일 아침 9시 「싱가포르·창기」 형무소에서 교수형으로 사라진 조문상(당시 26세·개성시)씨의 경우는 사형 집행 2분전까지 절박한 운명의 수기를 썼음이 드러나고 있다. 『전략…감방 안에선 언제 죽을지도 모르는 그러면서도 살아남아 있는 사람들이 부르는 「올드·랭·자인」의 노래 소리가 들린다. 「이 세상엔 미련 없다.」-. 그렇게 말한 사람들이 우습다. 영혼이라도 어딘가 인간 세상에 떠돌아 붙어 다녔으면 좋겠다. 아 살고 싶다. 그 어느 날 백운대의 암벽에 새겨 놓은 내 이름이 지금도 남아 있겠지. 그럼 부모님들 안녕.』 조씨는 그렇게도 살기를 바라면서도 형장의 이슬로 사라졌다. 조씨와 같은 시간에 처형된 김장록씨의 경우는 거의 영탄에 가까왔다. 『저 세상에는 정말 한국인이라든가 일본인이라든가 하는 구별은 없겠지.』- 그러면서도 그는 설움 받던 민족의 울분을 씹으며 사라져 간 것. 『특히 한국·대만 출신자가 전범자로 처형된 것은 기막힌 역사의 과오라 아니 할 수 없습니다. 일본인으로서는 그러한 영혼을 위로하는 것이 당연한 일 입지요.』 위령비 건립의 마지막 손질을 재촉하는 「고미야마」씨에게는 근엄할이 만큼 기도하는 마음이 가득 찬 것 같았다. 그는 『위령비 제막식에 유족들이 참가해 줬으면 얼마나 기쁘겠느냐?』고 말했다. <처형된 한국인 명단> 전범으로 처형된 한국출신의 명단은 다음과 같다.(괄호안은 처형 연월일) ▲김영주(46.7.30) ▲백천서(46.9.12) ▲홍사익(46.9.26) ▲강태협(46.11.22) ▲김귀호(46.11.22) ▲장수업(46.11.22) ▲김규언(47.1.9) ▲천광린(47.1.21) ▲김택진(47.1.21) ▲유삼천(47.2.4) ▲박영조(47.2.25) ▲김장녹(47.2.25) ▲조문상(47.2.25) ▲조윤태(47.3.23) ▲차균복(47.5.3) ▲박성근(47.5.5) ▲유천광웅(47.5.25) ▲박형준(47.6.12) ▲임영준(47.7.18) ▲변종윤(47.9.5) ▲박준식(47.9.5) ▲최창선(47.9.5) ▲김수인(48.1.23),"홍사익, 한국인 전범, 전쟁 범죄, 처형, 위령비, 일본",동경 강범석 특파원 제2차 대전의 전범자로 처형된 한국·대만 출신자 49명의 영혼을 달래기 위한 위령비가 오는 4월 초순 교도 시 히가시야마 고다이지 경내에 세워지게 되었다. 이 위령비의 건립을 위해 사뭇 애써온 일본 문화 연합회 대표 고미야마·노보루 53·동경도 세전곡구 송원정 1의 13의 9 씨는 일본 때문에 억울한 목숨을 잃은 사람의 명복을 비는 것은 바로 일본 사람의 의무 라는 신념으로 10여 년 동안 이 사업을 추진해 왔다. 1950년이래 전범 역류자 해방운동 협력회 를 조직 전범자들의 조기 석방운동을 벌여왔던 고미야마 씨는 57년도 의외에도 전범 처형자들 중에 한국인 출신자가 23명 대만 출신자가 26명이나 끼어 있음을 알아내고 이들 49명의 위패를 만들어 그해 4월 1일 교도시 의 영산관음에 안치했다. 이때부터 그는 다시 위령비의 건립을 기도했다. 그는 처형자의신원과 이력을 조사하고 그들이 남긴 유서를 모았다. 위령비의 대좌에는 그 자신 마가반야파라밀다심경 의 사경 1백권을 헌납키로 결심 2년째 걸려 사경을 모두 썼다. 이를 감은 권지는 무려 1백20 미터 . 49명의 각 위에는 될 수 있는 한 각자의 신분에 따라 불교·유교·기독교 그 밖의 경문·성구 혹은 자작시·헌영가를 구절마다 필사로 새겨 명복을 비는 마음을 한층 간절하게 했다. 이들 중 몇몇은 그들이 남긴 유서에서 전쟁의 비극 터질 듯한 민족의 울분 저주스러운 인간의 슬픔 등을 말해 주고 있어 눈물겨웠다. 1947년 2월 25일 아침 9시 싱가포르·창기 형무소에서 교수형으로 사라진 조문상 당시 26세·개성시 씨의 경우는 사형 집행 2분전까지 절박한 운명의 수기를 썼음이 드러나고 있다. 전략 감방 안에선 언제 죽을지도 모르는 그러면서도 살아남아 있는 사람들이 부르는 올드·랭·자인 의 노래 소리가 들린다. 이 세상엔 미련 없다. -. 그렇게 말한 사람들이 우습다. 영혼이라도 어딘가 인간 세상에 떠돌아 붙어 다녔으면 좋겠다. 아 살고 싶다. 그 어느 날 백운대의 암벽에 새겨 놓은 내 이름이 지금도 남아 있겠지. 그럼 부모님들 안녕. 조씨는 그렇게도 살기를 바라면서도 형장의 이슬로 사라졌다. 조씨와 같은 시간에 처형된 김장록씨의 경우는 거의 영탄에 가까왔다. 저 세상에는 정말 한국인이라든가 일본인이라든가 하는 구별은 없겠지. - 그러면서도 그는 설움 받던 민족의 울분을 씹으며 사라져 간 것. 특히 한국·대만 출신자가 전범자로 처형된 것은 기막힌 역사의 과오라 아니 할 수 없습니다. 일본인으로서는 그러한 영혼을 위로하는 것이 당연한 일 입지요. 위령비 건립의 마지막 손질을 재촉하는 고미야마 씨에게는 근엄할이 만큼 기도하는 마음이 가득 찬 것 같았다. 그는 위령비 제막식에 유족들이 참가해 줬으면 얼마나 기쁘겠느냐? 고 말했다. 전범으로 처형된 한국출신의 명단은 다음과 같다. 괄호안은 처형 연월일 김영주 46.7.30 백천서 46.9.12 홍사익 46.9.26 강태협 46.11.22 김귀호 46.11.22 장수업 46.11.22 김규언 47.1.9 천광린 47.1.21 김택진 47.1.21 유삼천 47.2.4 박영조 47.2.25 김장녹 47.2.25 조문상 47.2.25 조윤태 47.3.23 차균복 47.5.3 박성근 47.5.5 유천광웅 47.5.25 박형준 47.6.12 임영준 47.7.18 변종윤 47.9.5 박준식 47.9.5 최창선 47.9.5 김수인 48.1.23,"동경 강범석 특파원 제2차 대전의 전범자로 처형된 한국·대만 출신자 49명의 영혼을 달래기 위한 위령비가 오는 4월 초순 교도 시 히가시야마 고다이지 경내에 세워지게 되었다.
이 위령비의 건립을 위해 사뭇 애써온 일본 문화 연합회 대표 고미야마·노보루 53·동경도 세전곡구 송원정 1의 13의 9 씨는 일본 때문에 억울한 목숨을 잃은 사람의 명복을 비는 것은 바로 일본 사람의 의무 라는 신념으로 10여 년 동안 이 사업을 추진해 왔다.
1950년이래 전범 역류자 해방운동 협력회 를 조직 전범자들의 조기 석방운동을 벌여왔던 고미야마 씨는 57년도 의외에도 전범 처형자들 중에 한국인 출신자가 23명 대만 출신자가 26명이나 끼어 있음을 알아내고 이들 49명의 위패를 만들어 그해 4월 1일 교도시 의 영산관음에 안치했다.
이때부터 그는 다시 위령비의 건립을 기도했다.
그는 처형자의신원과 이력을 조사하고 그들이 남긴 유서를 모았다.
위령비의 대좌에는 그 자신 마가반야파라밀다심경 의 사경 1백권을 헌납키로 결심 2년째 걸려 사경을 모두 썼다.
이를 감은 권지는 무려 1백20 미터 .
49명의 각 위에는 될 수 있는 한 각자의 신분에 따라 불교·유교·기독교 그 밖의 경문·성구 혹은 자작시·헌영가를 구절마다 필사로 새겨 명복을 비는 마음을 한층 간절하게 했다.
이들 중 몇몇은 그들이 남긴 유서에서 전쟁의 비극 터질 듯한 민족의 울분 저주스러운 인간의 슬픔 등을 말해 주고 있어 눈물겨웠다.
1947년 2월 25일 아침 9시 싱가포르·창기 형무소에서 교수형으로 사라진 조문상 당시 26세·개성시 씨의 경우는 사형 집행 2분전까지 절박한 운명의 수기를 썼음이 드러나고 있다.
전략 감방 안에선 언제 죽을지도 모르는 그러면서도 살아남아 있는 사람들이 부르는 올드·랭·자인 의 노래 소리가 들린다.
이 세상엔 미련 없다.
-.
그렇게 말한 사람들이 우습다.
영혼이라도 어딘가 인간 세상에 떠돌아 붙어 다녔으면 좋겠다.
아 살고 싶다.
그 어느 날 백운대의 암벽에 새겨 놓은 내 이름이 지금도 남아 있겠지.
그럼 부모님들 안녕.
조씨는 그렇게도 살기를 바라면서도 형장의 이슬로 사라졌다.
조씨와 같은 시간에 처형된 김장록씨의 경우는 거의 영탄에 가까왔다.
저 세상에는 정말 한국인이라든가 일본인이라든가 하는 구별은 없겠지.
- 그러면서도 그는 설움 받던 민족의 울분을 씹으며 사라져 간 것.
특히 한국·대만 출신자가 전범자로 처형된 것은 기막힌 역사의 과오라 아니 할 수 없습니다.
일본인으로서는 그러한 영혼을 위로하는 것이 당연한 일 입지요.
위령비 건립의 마지막 손질을 재촉하는 고미야마 씨에게는 근엄할이 만큼 기도하는 마음이 가득 찬 것 같았다.
그는 위령비 제막식에 유족들이 참가해 줬으면 얼마나 기쁘겠느냐?
고 말했다.
전범으로 처형된 한국출신의 명단은 다음과 같다.
괄호안은 처형 연월일 김영주 46.7.30 백천서 46.9.12 홍사익 46.9.26 강태협 46.11.22 김귀호 46.11.22 장수업 46.11.22 김규언 47.1.9 천광린 47.1.21 김택진 47.1.21 유삼천 47.2.4 박영조 47.2.25 김장녹 47.2.25 조문상 47.2.25 조윤태 47.3.23 차균복 47.5.3 박성근 47.5.5 유천광웅 47.5.25 박형준 47.6.12 임영준 47.7.18 변종윤 47.9.5 박준식 47.9.5 최창선 47.9.5 김수인 48.1.23","동경 강범석 특파원 대전 전범 처형 한국 대만 출신 49 명의 영혼 달래기 위령비 오는 4월 초순 교도 가시야마 고다 이지 경내 세워지게 되었다
위령비 건립 위해 사뭇 애써 일본 문화 연합 대표 미야마 보루 53 동경도 전곡 송원 13 일본 때문 억울한 목숨 잃은 사람 명복 비는 바로 일본 사람 의무 라는 신념 10 동안 사업 추진 왔다
1950년 이래 전범 역류 해방운동 협력 조직 범자 조기 석방 운동 벌여 왔던 미야마 57년 의외 에도 전범 처형 한국인 출신 23 대만 출신 26 이나 끼어 알아내고 49 명의 위패 만들어 그해 4월 1일 도시 영산 관음 안치 했다
부터 다시 위령비 건립 기도 했다
처형 신원 이력 조사 하고 남긴 유서 모았다
위령비 대좌 에는 자신 마가 야파 밀다 심경 사경 헌납 키로 결심 2년 걸려 사경 모두 썼다
이를 감은 지는 무려 20 미터
49 명의 에는 있는 각자 신분 따라 불교 유교 기독교 성구 혹은 자작시 가를 구절 마다 필사 새겨 명복 비는 마음 한층 간절하게 했다
몇몇 남긴 유서 전쟁 비극 터질 민족 울분 저주 스러운 인간 슬픔 주고 있어 눈물 웠다
1947년 2월 25일 아침 9시 싱가포르 창기 형무소 교수형 사라진 문상 당시 26 개성시 경우 사형 집행 2분 전까지 절박 운명 수기 썼음 드러나고 있다
전략 감방 에선 언제 죽을지도 모르는 그러면서도 살아남아 있는 사람 부르는 올드 자인 노래 소리 들린다
세상 미련 없다
-.
그렇게 사람 우습다
영혼 이라도 어딘가 인간 세상 떠돌아 붙어 다녔으면 좋겠다
싶다
어느 암벽 새겨 놓은 이름 지금 남아 있겠지
그럼 부모님 안녕
조씨 그렇게도 살기 바라면서도 형장 이슬 사라졌다
조씨 시간 처형 김장 경우 거의 탄에 가까 왔다
세상 에는 정말 한국인 라든가 일본인 라든가 하는 구별 없겠지
그러면서도 설움 받던 민족 울분 씹으며 사라져
특히 한국 대만 출신 전범 처형 기막힌 역사 과오 아니 없습니다
일본인 으로서는 그러한 영혼 위로 하는 당연한 입지
위령비 건립 마지막 손질 재촉 하는 미야마 에게는 근엄할이 만큼 기도 하는 마음 가득 같았다
위령비 제막식 유족 참가 줬으면 얼마나 기쁘겠느냐
했다
전범 처형 한국 출신 명단 다음 같다
괄호 안은 처형 연월일 김영주 46.7 30 백천 46.9 12 홍사익 46.9 26 강태협 46.11 22 46.11 22 수업 46.11 22 김규 47.1 광린 47.1 21 김택진 47.1 21 삼천 47.2 박영 47.2 25 김장 47.2 25 문상 47.2 25 조윤태 47.3 23 차균복 47.5 박성근 47.5 유천 광웅 47.5 25 박형준 47.6 12 임영준 47.7 18 변종 47.9 박준식 47.9 최창선 47.9 김수인 48.1 23"
중앙일보,홍사익 일군중장 추도식,강범석,1967-09-27,"【동경=강범석특파원】한국인으로 일본 육군중장까지 지내다가 2차대전 후 연합군에 처형되었던 고 홍사익씨의 추도식이 26일 고인의 옛 동료 1백여 명과 고인의 장남 홍국선씨가 참석한가운데 「도꾜」의 「뉴·재팬·호텔」에서 엄수되었다. 일본재향군인회 회장 「우시로꾸」전 육군대장의 주최로 열린 이 추도식에는 전「인도네시아」주둔군 사령관「이마무라·히도시」씨와 재일 거류민단장 이유천씨 등이 나왔고 「사또」수상은 생화를 보냈다. 경기도 안성태생인 홍 중장은 「필리핀」의「칸루방」에 있던 일본 육군포로수용소 소장으로 있을 때 일본인 부하들이 연합군 포로들을 잔인하게 다루었다는 모든 책임을 지고 46년 「필리핀」에서 형이 집행되었다. 홍 장군은 1914년 일본육사를 졸업 후 일본군에 들어가 많은 요직을 맡았고 만주사변 때는 관동군의 참모장교로 크게 활약했었다. 고인의 유족인 미망인 이(60)여사와 장남 국선씨, 차남 현선씨가 서울 수유동에서 살고 있다. ","홍사익, 일본군, 한국인 전범, 추도식, 필리핀, 포로수용소","동경 강범석특파원 한국인으로 일본 육군중장까지 지내다가 2차대전 후 연합군에 처형되었던 고 홍사익씨의 추도식이 26일 고인의 옛 동료 1백여 명과 고인의 장남 홍국선씨가 참석한가운데 도꾜 의 뉴·재팬·호텔 에서 엄수되었다. 일본재향군인회 회장 우시로꾸 전 육군대장의 주최로 열린 이 추도식에는 전 인도네시아 주둔군 사령관 이마무라·히도시 씨와 재일 거류민단장 이유천씨 등이 나왔고 사또 수상은 생화를 보냈다. 경기도 안성태생인 홍 중장은 필리핀 의 칸루방 에 있던 일본 육군포로수용소 소장으로 있을 때 일본인 부하들이 연합군 포로들을 잔인하게 다루었다는 모든 책임을 지고 46년 필리핀 에서 형이 집행되었다. 홍 장군은 1914년 일본육사를 졸업 후 일본군에 들어가 많은 요직을 맡았고 만주사변 때는 관동군의 참모장교로 크게 활약했었다. 고인의 유족인 미망인 이 60 여사와 장남 국선씨, 차남 현선씨가 서울 수유동에서 살고 있다.","동경 강범석특파원 한국인으로 일본 육군중장까지 지내다가 2차대전 후 연합군에 처형되었던 고 홍사익씨의 추도식이 26일 고인의 옛 동료 1백여 명과 고인의 장남 홍국선씨가 참석한가운데 도꾜 의 뉴·재팬·호텔 에서 엄수되었다.
일본재향군인회 회장 우시로꾸 전 육군대장의 주최로 열린 이 추도식에는 전 인도네시아 주둔군 사령관 이마무라·히도시 씨와 재일 거류민단장 이유천씨 등이 나왔고 사또 수상은 생화를 보냈다.
경기도 안성태생인 홍 중장은 필리핀 의 칸루방 에 있던 일본 육군포로수용소 소장으로 있을 때 일본인 부하들이 연합군 포로들을 잔인하게 다루었다는 모든 책임을 지고 46년 필리핀 에서 형이 집행되었다.
홍 장군은 1914년 일본육사를 졸업 후 일본군에 들어가 많은 요직을 맡았고 만주사변 때는 관동군의 참모장교로 크게 활약했었다.
고인의 유족인 미망인 이 60 여사와 장남 국선씨, 차남 현선씨가 서울 수유동에서 살고 있다.","동경 강범석 특파원 한국인 일본 군중 까지 지내다가 대전 연합군 처형 되었던 홍사익 추도 식이 26일 고인 동료 백여 명과 고인 장남 홍국 선씨 참석 한가운데 도꾜 재팬 호텔 엄수 되었다
일본 재향군인회 회장 우시 군대장 주최 열린 추도 에는 인도네시아 주둔군 사령관 마무 도시 재일 거류 민단 이유천 나왔고 사또 수상 생화 보냈다
경기도 안성 태생 중장 필리핀 루방 있던 일본 육군 포로수용소 소장 있을 일본인 부하 연합군 포로 잔인하게 다루었다는 모든 책임 지고 46년 필리핀 집행 되었다
장군 1914년 육사 졸업 일본군 들어가 많은 맡았고 만주사변 관동군 참모 장교 크게 활약 했었다
고인 유족 미망인 60 여사 장남 국선 차남 선씨 서울 수유동 있다"
