source,title,author,date,content,topic,clean_content,sentences,tokenized_sentences
동아일보,◇重建된「三韓山斗」碑 제막식에참석하고 비석앞에서 기념 촬영한 삼학사의 후손들,,1986-01-30,"◇重建된「三韓山斗」碑 제막식에 참석하고 비석 앞에서 기념 촬영한 삼학사의 후손들. 오른쪽부터 洪思翊(횻날 일본육군중장·당시 관동군 사령부참모장), 吳學根, 洪承浩, 吳重根, 吳世英, 吳世民 제씨.","기념행사, 후손, 홍사익","된 제막식에 참석하고 비석 앞에서 기념 촬영한 삼학사의 후손들. 오른쪽부터 횻날 일본육군중장·당시 관동군 사령부참모장 , , , , , 제씨.","된 제막식에 참석하고 비석 앞에서 기념 촬영한 삼학사의 후손들.
오른쪽부터 횻날 일본육군중장·당시 관동군 사령부참모장 , , , , , 제씨.","제막식 참석 하고 비석 기념 촬영 삼학사 후손
오른쪽 부터 횻날 군중 당시 관동군 사령부 참모 제씨"
조선일보,新銳 대거 진출「의욕무대」예고,,1989-08-22,"현대예술극장의 「번제의 시간」 (최불암, 윤승원 등 출연)은 일제하에서 육군중장을 지냈다가 일본의 패전 후 전범으로 재판받고 냉소 속에 비극적으로 인생을 마감한 홍사익의 일생을 그렸으며.","연극, 홍사익, 전범, 비극","현대예술극장의 번제의 시간 최불암, 윤승원 등 출연 은 일제하에서 육군중장을 지냈다가 일본의 패전 후 전범으로 재판받고 냉소 속에 비극적으로 인생을 마감한 홍사익의 일생을 그렸으며.","현대예술극장의 번제의 시간 최불암, 윤승원 등 출연 은 일제하에서 육군중장을 지냈다가 일본의 패전 후 전범으로 재판받고 냉소 속에 비극적으로 인생을 마감한 홍사익의 일생을 그렸으며.",예술 극장 제의 시간 최불암 윤승원 출연 일제 군중 지냈다가 일본 패전 전범 재판 받고 냉소 비극 인생 마감 홍사익 일생 그렸으며
조선일보,서울연극제 참가 「燔祭의시간」 연출 美서 20년만에 귀국 정일성씨,,1989-09-07,"이번작품 「번제의 시간』 은일제시대에 한국인으로서는유일하게 일본육군 중 장까지지냈다가 45년 연합국 전범재판에서 사형을 선고 받고처형됐던 홍사익 의 이야기. 이 연극은 홍사익의 일대기도 아니고 그를 재평가하려는 무대도 아닙니다. 식민지치하라는 특수한 역사적상황에서 시류를 따르다 결국 교수대에 올랐던 그 가 죽음앞에서 어떤 자각에 이르렀을까를 파헤치는 「인간탐구』 의 무대입니다. 따라서 그는 법정장면이대부분인 이번공연에서 장치와 조명, 의상에 이르기까 지자연주의적인 일상성을 배제하고 관객과의 소리없는 대화로 「문제」 에 대한 성찰과 상상을 유도하는 마당을만들겠다고했다. 그것은 『연극의 특성은 무엇 을 보여주는것이 아니라 문제를 탐구하게 하는 것이며 이특성을 살리는 것만이 연극의 살길』 이라는 그의 지론 때문이다.","정일성, 번제의 시간","이번작품 번제의 시간 은일제시대에 한국인으로서는유일하게 일본육군 중 장까지지냈다가 45년 연합국 전범재판에서 사형을 선고 받고처형됐던 홍사익 의 이야기. 이 연극은 홍사익의 일대기도 아니고 그를 재평가하려는 무대도 아닙니다. 식민지치하라는 특수한 역사적상황에서 시류를 따르다 결국 교수대에 올랐던 그 가 죽음앞에서 어떤 자각에 이르렀을까를 파헤치는 인간탐구 의 무대입니다. 따라서 그는 법정장면이대부분인 이번공연에서 장치와 조명, 의상에 이르기까 지자연주의적인 일상성을 배제하고 관객과의 소리없는 대화로 문제 에 대한 성찰과 상상을 유도하는 마당을만들겠다고했다. 그것은 연극의 특성은 무엇 을 보여주는것이 아니라 문제를 탐구하게 하는 것이며 이특성을 살리는 것만이 연극의 살길 이라는 그의 지론 때문이다.","이번작품 번제의 시간 은일제시대에 한국인으로서는유일하게 일본육군 중 장까지지냈다가 45년 연합국 전범재판에서 사형을 선고 받고처형됐던 홍사익 의 이야기.
이 연극은 홍사익의 일대기도 아니고 그를 재평가하려는 무대도 아닙니다.
식민지치하라는 특수한 역사적상황에서 시류를 따르다 결국 교수대에 올랐던 그 가 죽음앞에서 어떤 자각에 이르렀을까를 파헤치는 인간탐구 의 무대입니다.
따라서 그는 법정장면이대부분인 이번공연에서 장치와 조명, 의상에 이르기까 지자연주의적인 일상성을 배제하고 관객과의 소리없는 대화로 문제 에 대한 성찰과 상상을 유도하는 마당을만들겠다고했다.
그것은 연극의 특성은 무엇 을 보여주는것이 아니라 문제를 탐구하게 하는 것이며 이특성을 살리는 것만이 연극의 살길 이라는 그의 지론 때문이다.","이번 작품 제의 시간 일제시대 한국인 으로서는 유일하게 일본 육군 까지 지냈다가 45년 연합국 전범재판 사형 선고 받고 처형 됐던 홍사익 이야기
연극 홍사익 일대기 아니고 평가 하려는 무대 아닙니다
식민지 치하 라는 특수한 역사 상황 시류 따르다 결국 교수대 올랐던 죽음 어떤 자각 이르 까를 파헤치는 인간 탐구 무대 입니다
따라서 법정 대부분 이번 공연 장치 조명 의상 이르기 자연 주의 일상 배제 하고 관객 과의 소리 없는 대화 문제 대한 성찰 상상 유도 하는 마당 만들겠다고 했다
그것 연극 특성 무엇 보여주는것이 아니라 문제 탐구 하게 하는 이며 특성 살리는 만이 연극 살길 이라는 지론 때문"
동아일보,"연극舞臺 11년만에 서는 崔佛岩씨 """"韓國人 얼 나타내는 연기자가 필생의 꿈"""" ", ,1989-10-03,"TV의 대표적 스타인&1(최불암)씨(49)가 11년만에연극무대에 섰다. 4일 부터 9일까지(오후4시반7시반)문예회관 대극장에서공연중인 현대예술극장의 서울연극제참가작 「번제의시간』 (노경식 정일성연출)에서 주인공 홍사익 장군역에 출연하고 있는것. ""연극이란 (도)를닦는 자세로 해야 하는데 그럴 여건이 못돼 무대에 서지못 했으나 옛날 호흡을 맞췄던정일성씨가 미국유학을 마치고 20년만에 이 작품연 출을 맡게돼 서로 연극에의 열정을 확인코자 나섰습니다 최씨는 78년 「베니스의상인』 에 출연한후 연극무대에 서지 않았으나 * 홍사익역이 꼭 해보고싶어 출연하게 됐다고 말했다. 이번 연극에서 저는 일제 식민치하에서 일본군장성으로 있다 패전후 1급 전범 자로 처형당한 한국인 홍사익 역을 맡습니다. 홍사익의 운명은 그자신 의 선택임을 제시해주는내용으로 오늘의 시점에서도 시사하는 바가 크다고봅 니다 최씨는 친일파가 역사적으로 정리되지 않은 것이오늘의 상황을 더욱 꼬이 게 하고 있어 이 연극을무대에 올렸다면서 연기자로서 한국인상을 부각시키는 게 필생의 작업이라고말했다. 미국의 연기자 하면 개척적인 미국정신을 대표하는 존웨인 게리 쿠퍼를 들듯 한국정신을 대표하는연기자로 「((최불암)」 이 떠오르도록 하려고 노력 합니다. 나의 연기특징을 질그릇에 비유하는 사람도 있으나 가부장적이면서 자 애로운것을 제 연기컬러로세워나가고 있습니다. 그러나 뜻대로 되지않아 안타 깝습니다""","연극, 홍사익, 최불암, 친일파, 한국정신",TV의 대표적 스타인 1 최불암 씨 49 가 11년만에연극무대에 섰다. 4일 부터 9일까지 오후4시반7시반 문예회관 대극장에서공연중인 현대예술극장의 서울연극제참가작 번제의시간 노경식 정일성연출 에서 주인공 홍사익 장군역에 출연하고 있는것. 연극이란 도 를닦는 자세로 해야 하는데 그럴 여건이 못돼 무대에 서지못 했으나 옛날 호흡을 맞췄던정일성씨가 미국유학을 마치고 20년만에 이 작품연 출을 맡게돼 서로 연극에의 열정을 확인코자 나섰습니다 최씨는 78년 베니스의상인 에 출연한후 연극무대에 서지 않았으나 홍사익역이 꼭 해보고싶어 출연하게 됐다고 말했다. 이번 연극에서 저는 일제 식민치하에서 일본군장성으로 있다 패전후 1급 전범 자로 처형당한 한국인 홍사익 역을 맡습니다. 홍사익의 운명은 그자신 의 선택임을 제시해주는내용으로 오늘의 시점에서도 시사하는 바가 크다고봅 니다 최씨는 친일파가 역사적으로 정리되지 않은 것이오늘의 상황을 더욱 꼬이 게 하고 있어 이 연극을무대에 올렸다면서 연기자로서 한국인상을 부각시키는 게 필생의 작업이라고말했다. 미국의 연기자 하면 개척적인 미국정신을 대표하는 존웨인 게리 쿠퍼를 들듯 한국정신을 대표하는연기자로 최불암 이 떠오르도록 하려고 노력 합니다. 나의 연기특징을 질그릇에 비유하는 사람도 있으나 가부장적이면서 자 애로운것을 제 연기컬러로세워나가고 있습니다. 그러나 뜻대로 되지않아 안타 깝습니다,"TV의 대표적 스타인 1 최불암 씨 49 가 11년만에연극무대에 섰다.
4일 부터 9일까지 오후4시반7시반 문예회관 대극장에서공연중인 현대예술극장의 서울연극제참가작 번제의시간 노경식 정일성연출 에서 주인공 홍사익 장군역에 출연하고 있는것.
연극이란 도 를닦는 자세로 해야 하는데 그럴 여건이 못돼 무대에 서지못 했으나 옛날 호흡을 맞췄던정일성씨가 미국유학을 마치고 20년만에 이 작품연 출을 맡게돼 서로 연극에의 열정을 확인코자 나섰습니다 최씨는 78년 베니스의상인 에 출연한후 연극무대에 서지 않았으나 홍사익역이 꼭 해보고싶어 출연하게 됐다고 말했다.
이번 연극에서 저는 일제 식민치하에서 일본군장성으로 있다 패전후 1급 전범 자로 처형당한 한국인 홍사익 역을 맡습니다.
홍사익의 운명은 그자신 의 선택임을 제시해주는내용으로 오늘의 시점에서도 시사하는 바가 크다고봅 니다 최씨는 친일파가 역사적으로 정리되지 않은 것이오늘의 상황을 더욱 꼬이 게 하고 있어 이 연극을무대에 올렸다면서 연기자로서 한국인상을 부각시키는 게 필생의 작업이라고말했다.
미국의 연기자 하면 개척적인 미국정신을 대표하는 존웨인 게리 쿠퍼를 들듯 한국정신을 대표하는연기자로 최불암 이 떠오르도록 하려고 노력 합니다.
나의 연기특징을 질그릇에 비유하는 사람도 있으나 가부장적이면서 자 애로운것을 제 연기컬러로세워나가고 있습니다.
그러나 뜻대로 되지않아 안타 깝습니다","TV 대표 스타인 최불암 49 11년 만에연극무대에 섰다
4일 부터 9일 까지 오후 4시 7시 회관 대극장 공연 예술 극장 서울 연극제 참가 제의 시간 노경식 정일 연출 주인공 홍사익 장군 출연 하고 있는것
연극 이란 닦는 자세 해야 하는데 그럴 여건 무대 서지못 했으나 옛날 호흡 맞췄던 정일 성씨 미국 유학 마치 20년 만에 작품 출을 맡게 서로 연극 에의 열정 확인 나섰습니다 최씨 78년 베니스 의상 출연 무대 서지 않았으나 홍사익 해보고싶어 출연 하게 됐다고 했다
이번 연극 일제 식민 치하 일본군 장성 있다 패전 전범 자로 처형 한국인 홍사익 맡습니다
홍사익 운명 자신 선택 제시 해주는 내용 오늘 시점 에서도 시사 하는 크다고 니다 최씨 친일파 역사 정리 되지 않은 오늘 상황 더욱 꼬이 하고 있어 연극 무대 올렸다면서 연기자 로서 한국인 부각시키는 필생 작업 이라고 했다
미국 연기자 하면 개척 미국 정신 대표 하는 존웨인 게리 쿠퍼 들듯 한국 정신 대표 하는 연기자 최불암 떠오르도록 하려고 노력 합니다
특징 질그릇 비유 하는 사람 있으나 가부장 면서 애로 운것을 컬러 로세 나가고 있습니다
뜻대로 되지 않아 안타 깝습니"
조선일보,洪사익장군 探究무대「번제의 시간」4~9일, ,1989-10-05,"서울연극제의 마지막 공연인 극단 현대예술극장의 「번제의 시간』 (노경식 작)이 4일부터 9일까지 문예회관 대극장무대에 오른다. 일제시대 조선인 으로서는 유일하게 일본군장성에까지 몰랐던 홍사익의 이야기를 그린 작품.일 본의패전후 처형당했던 그가죽음앞에서어떠한 자각에 이르렀을까를 파헤친 인물탐구의 연극이다. 재미연출가 정일성씨가 20여년만에 고국무대에서 연출을 맡았고, 최불암씨가 10여년만에연극무대로돌아와 홍장군역을 열연 한다. 개막은 4시30분,7시30분.","번제의 시간, 홍사익, 서울연극제","서울연극제의 마지막 공연인 극단 현대예술극장의 번제의 시간 노경식 작 이 4일부터 9일까지 문예회관 대극장무대에 오른다. 일제시대 조선인 으로서는 유일하게 일본군장성에까지 몰랐던 홍사익의 이야기를 그린 작품.일 본의패전후 처형당했던 그가죽음앞에서어떠한 자각에 이르렀을까를 파헤친 인물탐구의 연극이다. 재미연출가 정일성씨가 20여년만에 고국무대에서 연출을 맡았고, 최불암씨가 10여년만에연극무대로돌아와 홍장군역을 열연 한다. 개막은 4시30분,7시30분.","서울연극제의 마지막 공연인 극단 현대예술극장의 번제의 시간 노경식 작 이 4일부터 9일까지 문예회관 대극장무대에 오른다.
일제시대 조선인 으로서는 유일하게 일본군장성에까지 몰랐던 홍사익의 이야기를 그린 작품.일 본의패전후 처형당했던 그가죽음앞에서어떠한 자각에 이르렀을까를 파헤친 인물탐구의 연극이다.
재미연출가 정일성씨가 20여년만에 고국무대에서 연출을 맡았고, 최불암씨가 10여년만에연극무대로돌아와 홍장군역을 열연 한다.
개막은 4시30분,7시30분.","연극제 마지막 공연 극단 예술 극장 제의 시간 노경식 4일 부터 9일 까지 회관 대극장 무대 오른다
일제시대 조선인 으로서는 유일하게 일본군 장성 에까지 몰랐던 홍사익 이야기 그린 작품 본의 패전 처형 당했던 가죽 음앞 어떠한 자각 이르 까를 파헤친 인물 탐구 연극
재미 연출가 정일 성씨 20 만에 고국 무대 연출 맡았고 최불암 10 만에 무대 돌아와 군역 열연 한다
개막 4시 30분 7시 30분"
매일경제,탤런트 崔佛岩 「수사반장」20년 긍지 느껴, ,1989-10-06,"그는 요즘 변신을 꾀하고 있다. 12년만에 연기의고향인 연극무대로 돌아와구 슬땀을 흘리고 있는 것이다. 그가 대표직을 맡고있는 현대예술극장의 제 13회 서울연극제 참가작 「번제의 시간』 에서후로시(한국인)으로선 유일하게 B*( 일본)군인이된홍사익역을 맡아 멸연하고있다. ""오랜만에 연극에 출연하니 TV와는 달리 또 다른긴장감이 오는군요""라며그는 TV의 메커니즘에가려졌던 살아있는 연기를온몸으로 보여주겠다고 특유의 웃 음을 짓는다.","연극, 홍사익, 최불암, 서울연극제, 현대예술극장",그는 요즘 변신을 꾀하고 있다. 12년만에 연기의고향인 연극무대로 돌아와구 슬땀을 흘리고 있는 것이다. 그가 대표직을 맡고있는 현대예술극장의 제 13회 서울연극제 참가작 번제의 시간 에서후로시 한국인 으로선 유일하게 B 일본 군인이된홍사익역을 맡아 멸연하고있다. 오랜만에 연극에 출연하니 TV와는 달리 또 다른긴장감이 오는군요 라며그는 TV의 메커니즘에가려졌던 살아있는 연기를온몸으로 보여주겠다고 특유의 웃 음을 짓는다.,"그는 요즘 변신을 꾀하고 있다.
12년만에 연기의고향인 연극무대로 돌아와구 슬땀을 흘리고 있는 것이다.
그가 대표직을 맡고있는 현대예술극장의 제 13회 서울연극제 참가작 번제의 시간 에서후로시 한국인 으로선 유일하게 B 일본 군인이된홍사익역을 맡아 멸연하고있다.
오랜만에 연극에 출연하니 TV와는 달리 또 다른긴장감이 오는군요 라며그는 TV의 메커니즘에가려졌던 살아있는 연기를온몸으로 보여주겠다고 특유의 웃 음을 짓는다.","요즘 변신 하고 있다
12년 만에 연기 고향 무대 돌아와구 슬땀 흘리고 있는
대표 맡고있는 예술 극장 13회 서울 연극제 참가 제의 시간 로시 한국인 으로선 유일하게 일본 군인 홍사익 맡아 연하고있다
오랜 연극 출연 하니 TV 와는 달리 다른 긴장감 오는군요 라며 TV 메커니즘 가려졌던 살아있는 연기 온몸 보여주겠다고 특유 짓는다"
매일경제,「번제의 시간」극단 현대예술극장, ,1989-10-07,"「번제의 시간」 극단 현대예술극장 시대상황이 만든 한 인간의 고뇌 노경식작,정일성연출의 「번제의 시간』 은 극단현대예술극장이 창단 처음으로 서울연극제에 참가한 작품이다. 「번제의 시간」 은 조선인으로서 일본군장성 에까지 오른홍사익장군이 2차대전 종료후 마닐라전범재판소에서 사형된 사건 을 극화했다. 극진행이 재판과정으로 엮어진 이 작품은 장치와 조명,의상등이 자연주의적 일 상성을 배제한가운데 인물에포커스를 맞추고 있다. 즉 관객으로 하여금 비판적의식을 일깨워주는 일종의서사극수법을 취하고 있 는것이다. 무대는 45년 태평양전쟁후마닐라에서 열리는 미영연합국 전범재판소. 일본제국의 육군중장 홍사익은 한국인으로서는 유일하게 일본군의 병참총감 겸 포로관리소장이 된다. 그는 직책에 따라 수많은 미군포로및 민간인 억류자를 고문, 학살한다. 그러던중 일본이패망하자 그는 제네바국제조약을 위 반했다는 혐의로군사법정에 기소된다. 연출자 정일성씨는""민족과 나라를 외면한채 거대한 탁류 속을 헤엄칠 수밖에 없 었던 한 인간의 고뇌와 시대의 아픔을 그렸다""고 연출의도를 밝히고 있다.","연극, 홍사익, 현대예술극장, 서울연극제, 마닐라 전범재판","번제의 시간 극단 현대예술극장 시대상황이 만든 한 인간의 고뇌 노경식작,정일성연출의 번제의 시간 은 극단현대예술극장이 창단 처음으로 서울연극제에 참가한 작품이다. 번제의 시간 은 조선인으로서 일본군장성 에까지 오른홍사익장군이 2차대전 종료후 마닐라전범재판소에서 사형된 사건 을 극화했다. 극진행이 재판과정으로 엮어진 이 작품은 장치와 조명,의상등이 자연주의적 일 상성을 배제한가운데 인물에포커스를 맞추고 있다. 즉 관객으로 하여금 비판적의식을 일깨워주는 일종의서사극수법을 취하고 있 는것이다. 무대는 45년 태평양전쟁후마닐라에서 열리는 미영연합국 전범재판소. 일본제국의 육군중장 홍사익은 한국인으로서는 유일하게 일본군의 병참총감 겸 포로관리소장이 된다. 그는 직책에 따라 수많은 미군포로및 민간인 억류자를 고문, 학살한다. 그러던중 일본이패망하자 그는 제네바국제조약을 위 반했다는 혐의로군사법정에 기소된다. 연출자 정일성씨는 민족과 나라를 외면한채 거대한 탁류 속을 헤엄칠 수밖에 없 었던 한 인간의 고뇌와 시대의 아픔을 그렸다 고 연출의도를 밝히고 있다.","번제의 시간 극단 현대예술극장 시대상황이 만든 한 인간의 고뇌 노경식작,정일성연출의 번제의 시간 은 극단현대예술극장이 창단 처음으로 서울연극제에 참가한 작품이다.
번제의 시간 은 조선인으로서 일본군장성 에까지 오른홍사익장군이 2차대전 종료후 마닐라전범재판소에서 사형된 사건 을 극화했다.
극진행이 재판과정으로 엮어진 이 작품은 장치와 조명,의상등이 자연주의적 일 상성을 배제한가운데 인물에포커스를 맞추고 있다.
즉 관객으로 하여금 비판적의식을 일깨워주는 일종의서사극수법을 취하고 있 는것이다.
무대는 45년 태평양전쟁후마닐라에서 열리는 미영연합국 전범재판소.
일본제국의 육군중장 홍사익은 한국인으로서는 유일하게 일본군의 병참총감 겸 포로관리소장이 된다.
그는 직책에 따라 수많은 미군포로및 민간인 억류자를 고문, 학살한다.
그러던중 일본이패망하자 그는 제네바국제조약을 위 반했다는 혐의로군사법정에 기소된다.
연출자 정일성씨는 민족과 나라를 외면한채 거대한 탁류 속을 헤엄칠 수밖에 없 었던 한 인간의 고뇌와 시대의 아픔을 그렸다 고 연출의도를 밝히고 있다.","제의 시간 극단 현대 예술 극장 상황 만든 인간 고뇌 노경식 정일 연출 제의 시간 예술 극장 창단 처음 연극제 참가 작품
제의 시간 조선인 으로서 일본군 장성 에까지 오른 홍사익 장군 대전 종료 마닐라 전범 재판소 사형 사건 극화 했다
진행 재판 과정 어진 작품 장치 조명 의상 자연 주의 배제 한가운데 인물 포커스 맞추고 있다
관객 하여금 비판 의식 깨워주는 일종 수법 취하 는것이다
무대 45년 태평양 전쟁 마닐라 열리는 미영 연합국 전범 재판소
일본제국 육군 중장 홍사익 한국인 으로서는 유일하게 일본군 병참 포로 관리소 장이 된다
직책 따라 수많은 미군 포로 민간인 억류 고문 학살 한다
그러던 일본 망하자 제네바 국제 조약 반했다는 혐의 로군 법정 기소 된다
연출자 정일 성씨 민족 나라 외면 거대한 탁류 헤엄 밖에 었던 인간 고뇌 시대 아픔 그렸다 연출 의도 밝히고 있다"
