source,title,author,date,content,topic,clean_content,sentences,tokenized_sentences
한국경제신문,[해외신간 다이제스트] '홍사익 중장의 처형' .. 재조명,,1998-10-29,"우리가 이 책에 관심을 갖는 것은 금세기를 마감하며 과거사 정리 차원에서 꼭 짚고 넘어가야 할 한일관계사의 한 부분이기 때문이다. 애국지사의 유해봉환 종군위안부에 대한 보상 징용으로 끌려간 생존 동포의 영주귀국 등이 이루어지고 있는 데 비해 일본군으로 참전했던 희생자는 관심 밖으로 밀려나 있다. 그 때 희생된 2만여명의 한국인 군인과 군속은 조국의 무관심 속에서 지금도 야스쿠니신사에 봉안돼 있다. 그러나 일본육사나 학도병 출신으로 살아남은 자는 해방후 엘리트로 대접받고 조국에서 건군의 주역이 된 경우도 적지 않다. 홍사익의 일본육사 동기생으로는 광복군 사령관으로 유명한 이청천 장군과 해방후 한국육군을 창건한 초대 참모총장 이응준 장군이 있다. 홍사익은 계림회라는 유학생 친목회의 리더로서 친구 이청천과 김광서 등 서울에 남아 곤경에 처한 선후배 광복군 지도자의 가족들을 비밀리에 도와주었다고 한다. 그는 일본식 발음으로 불리기는 했지만 창씨개명을 하지 않고 한국식 이름을 고집했다. 대한제국 유학생으로 교육받던 중 국권피탈의 비운을 맞은 그는 여단장을 거쳐 이른바 구름위의 사람으로 일컬어지는 일본군 고위 장성에까지 오른 한국출신 장교의 상징적 존재였다. 그는 일본이 항복하자 부관에게 고국에 돌아가서 수학선생이 되고 싶다고 말했지만 끝내 뜻을 이루지 못했다. 저자는 태평양전쟁에 초급장교로 참전하여 루손섬에서 미군의 포로가 됐던 인물. 그는 이 책을 한 사람의 전기가 아니라 전범재판에 초점을 맞춰 집필했다고 밝혔다. 미국 국립자료보존소에 보관된 1천여 쪽의 방대한 기록을 발췌해 번역하고 일본 국내 관계자의 증언기록과 인터뷰 서울에서의 관련 인사 취재결과를 담았다. 저자의 주관적 추측과 논리적 비약 영문 재판기록을 일어로 번역하는 과정에서 모호해진 부분도 있지만 사료적 가치가 큰 내용이 많다. 포로들의 생활상을 그린 부분은 전쟁의 참혹함을 되돌아보게 한다.""","홍사익, 전범재판, 일본군, 한국인 장교, 전기, 역사",우리가 이 책에 관심을 갖는 것은 금세기를 마감하며 과거사 정리 차원에서 꼭 짚고 넘어가야 할 한일관계사의 한 부분이기 때문이다. 애국지사의 유해봉환 종군위안부에 대한 보상 징용으로 끌려간 생존 동포의 영주귀국 등이 이루어지고 있는 데 비해 일본군으로 참전했던 희생자는 관심 밖으로 밀려나 있다. 그 때 희생된 2만여명의 한국인 군인과 군속은 조국의 무관심 속에서 지금도 야스쿠니신사에 봉안돼 있다. 그러나 일본육사나 학도병 출신으로 살아남은 자는 해방후 엘리트로 대접받고 조국에서 건군의 주역이 된 경우도 적지 않다. 홍사익의 일본육사 동기생으로는 광복군 사령관으로 유명한 이청천 장군과 해방후 한국육군을 창건한 초대 참모총장 이응준 장군이 있다. 홍사익은 계림회라는 유학생 친목회의 리더로서 친구 이청천과 김광서 등 서울에 남아 곤경에 처한 선후배 광복군 지도자의 가족들을 비밀리에 도와주었다고 한다. 그는 일본식 발음으로 불리기는 했지만 창씨개명을 하지 않고 한국식 이름을 고집했다. 대한제국 유학생으로 교육받던 중 국권피탈의 비운을 맞은 그는 여단장을 거쳐 이른바 구름위의 사람으로 일컬어지는 일본군 고위 장성에까지 오른 한국출신 장교의 상징적 존재였다. 그는 일본이 항복하자 부관에게 고국에 돌아가서 수학선생이 되고 싶다고 말했지만 끝내 뜻을 이루지 못했다. 저자는 태평양전쟁에 초급장교로 참전하여 루손섬에서 미군의 포로가 됐던 인물. 그는 이 책을 한 사람의 전기가 아니라 전범재판에 초점을 맞춰 집필했다고 밝혔다. 미국 국립자료보존소에 보관된 1천여 쪽의 방대한 기록을 발췌해 번역하고 일본 국내 관계자의 증언기록과 인터뷰 서울에서의 관련 인사 취재결과를 담았다. 저자의 주관적 추측과 논리적 비약 영문 재판기록을 일어로 번역하는 과정에서 모호해진 부분도 있지만 사료적 가치가 큰 내용이 많다. 포로들의 생활상을 그린 부분은 전쟁의 참혹함을 되돌아보게 한다.,"우리가 이 책에 관심을 갖는 것은 금세기를 마감하며 과거사 정리 차원에서 꼭 짚고 넘어가야 할 한일관계사의 한 부분이기 때문이다.
애국지사의 유해봉환 종군위안부에 대한 보상 징용으로 끌려간 생존 동포의 영주귀국 등이 이루어지고 있는 데 비해 일본군으로 참전했던 희생자는 관심 밖으로 밀려나 있다.
그 때 희생된 2만여명의 한국인 군인과 군속은 조국의 무관심 속에서 지금도 야스쿠니신사에 봉안돼 있다.
그러나 일본육사나 학도병 출신으로 살아남은 자는 해방후 엘리트로 대접받고 조국에서 건군의 주역이 된 경우도 적지 않다.
홍사익의 일본육사 동기생으로는 광복군 사령관으로 유명한 이청천 장군과 해방후 한국육군을 창건한 초대 참모총장 이응준 장군이 있다.
홍사익은 계림회라는 유학생 친목회의 리더로서 친구 이청천과 김광서 등 서울에 남아 곤경에 처한 선후배 광복군 지도자의 가족들을 비밀리에 도와주었다고 한다.
그는 일본식 발음으로 불리기는 했지만 창씨개명을 하지 않고 한국식 이름을 고집했다.
대한제국 유학생으로 교육받던 중 국권피탈의 비운을 맞은 그는 여단장을 거쳐 이른바 구름위의 사람으로 일컬어지는 일본군 고위 장성에까지 오른 한국출신 장교의 상징적 존재였다.
그는 일본이 항복하자 부관에게 고국에 돌아가서 수학선생이 되고 싶다고 말했지만 끝내 뜻을 이루지 못했다.
저자는 태평양전쟁에 초급장교로 참전하여 루손섬에서 미군의 포로가 됐던 인물.
그는 이 책을 한 사람의 전기가 아니라 전범재판에 초점을 맞춰 집필했다고 밝혔다.
미국 국립자료보존소에 보관된 1천여 쪽의 방대한 기록을 발췌해 번역하고 일본 국내 관계자의 증언기록과 인터뷰 서울에서의 관련 인사 취재결과를 담았다.
저자의 주관적 추측과 논리적 비약 영문 재판기록을 일어로 번역하는 과정에서 모호해진 부분도 있지만 사료적 가치가 큰 내용이 많다.
포로들의 생활상을 그린 부분은 전쟁의 참혹함을 되돌아보게 한다.","우리 관심 갖는 금세기 마감 하며 과거 정리 차원 짚고 넘어가야 한일관계 사의 부분 이기 때문
애국지사 유해 봉환 종군위안부 대한 보상 징용 끌려 생존 동포 영주 귀국 이루어지고 있는 비해 일본군 참전 했던 희생 관심 밀려나 있다
희생 2만 여명의 한국인 군인 군속 조국 무관심 지금 야스쿠니신사 봉안 있다
육사 학도병 출신 살아남은 자는 해방 엘리트 대접받고 조국 주역 경우 적지 않다
홍사익 일본 육사 기생 으로는 광복군 사령관 유명한 이청천 장군 해방 한국 육군 창건 초대 참모총장 이응준 장군 있다
홍사익 계림 라는 유학생 친목 회의 리더 로서 친구 이청천 김광서 서울 남아 곤경 선후배 광복군 지도자 가족 비밀리 도와주었다고 한다
일본 발음 불리 기는 했지만 창씨개명 하지 않고 한국 이름 고집 했다
대한제국 유학생 교육 받던 국권 탈의 비운 맞은 단장 거쳐 이른바 구름 사람 지는 일본군 고위 장성 에까지 오른 한국 출신 장교 상징 존재 였다
일본 항복 하자 부관 에게 고국 돌아가서 수학 선생 되고 싶다고 했지만 끝내 이루지 했다
저자 태평양 전쟁 장교 참전 하여 루손섬 미군 포로 됐던 인물
사람 전기 아니라 전범재판 초점 맞춰 집필 했다고 밝혔다
미국 국립 자료 보존 보관 1천 방대한 기록 발췌 번역 하고 일본 국내 관계자 증언 기록 인터뷰 서울 에서의 관련 인사 취재 결과 담았다
저자 주관 추측 논리 비약 영문 재판 기록 일어 번역 하는 과정 모호해진 부분 있지만 사료 가치 내용 많다
포로 생활 그린 부분 전쟁 참혹함을 되돌아보게 한다"
문화일보,민硏 친일인명사전 사회운동차원서 편찬키로, ,1999-08-16,"91년 창립이후 친일역사 청산문제를 지속적으로 연구해온 민족문제연구소(소장 김봉우)가 최근 ‘친일인명사전’ 편찬계획을 공식발표(관련기사 본지 12일자, 일부지방 13일자)하면서 이 사전에 수록될 ‘친일파’ 인물들의 면면에 관심이 쏠리고 있다.연구소는 사전발간을 지지하는 교수 1만명의 서명을 받은데 이어 앞으로 이 작업을 사회운동의 차원으로 발전시켜 나갈 계획이다. 연구소측이 1차로 선정한 인물은 1백명. 을사오적으로 불리는 권중현,박제순,이근택,이완용,이지용을 비롯해 일진회 회원이었던 송병준,이용구,윤갑병,윤시병 등이 명단에 포함돼있다. 민원식,박상준,박중양,석진형 등은 ‘직업적 친일분자’로 분류돼있고 경찰·군인분야에는 박정희,백선엽,홍사익 등의 이름이 눈에 띈다. 일반인들의 관심이 가장 많이 쏠리는 분야는 사회·문화분야이다. 우리나라 최초의 신소설로 평가받는 ‘혈(血)의 누(淚)’ 작가 이인직을 비롯해 유진오,백낙준,이병도,최남선(학술),김활란(여성),김동인,모윤숙,유치진,이광수(문학),김은호,이상범,현제명,홍난파(미술 음악)등이 ‘친일인명사전’에 첫번째로 오를 예정이다. 연구소는 ‘친일인물사전’이 20세기 한국사를 정리하고 21세기 새로운 도약을 위한 밑거름으로서 역사적 의미를 인정받는 것은 명확한 선정기준과 구체적인 증거자료를 기초로 한 평가작업에 달려 있다고 지적한다. 선정기준은 첫째 일제 식민체제에 어느정도 협력했는가, 둘째 광복이후 한국현대사에서 식민지배의 유산이 재생산되는 과정에서 어떤 역할을 했는가이다. “식민체제하에서 과연 친일파가 아닌 사람이 누가 있었겠는가라고 말하는 이도 있습니다. 물론 친일파로 알려진 분들 중에는 시대 분위기 속에서 마지못해 식민체제에 협조한 이도 있지요. 연구소가 이런 이들에 대해 단죄를 하자는 것이 결코 아니며 그럴 권리도 없습니다. 다만 객관적인 자료를 갖고 각 인물들의 친일행적을 정확하게 기록하려는 것 뿐입니다. 따라서 아무리 심증이 가는 친일파라 할지라도 구체적인 증거자료가 없을 경우에는 과감히 사전에서 제외될 겁니다.” 김민철 책임연구원은 “일제말기 20대 후반의 젊은 나이였던 박정희 전대통령은 비록 당시에는 사회 지도층이 아니었지만 만약 식민지배가 계속됐다면 적극 협력했을 것”이라며 “그동안 후손들로부터 고소당하는 사건도 적지 않았고 갈등과 곤혹스러움을 느낄때도 있었지만 해방이후 현재까지 왜곡돼온 역사의식과 가치관을 바로잡는데 충실하겠다”고 말했다. 2002년 발간예정인 ‘친일인명사전’은 백과사전 30권분량 규모. 자료수집비 40억∼50억원, 출판비 30억원이 예상되는 방대한 작업이다. 구성은 1부 일제의 식민정책 및 이후 한국사회에 미친 영향(가제), 2부 친일단체 활동내용 및 명부, 3부 친일인명사전으로 꾸며진다. 인명사전에는 최대 3천여명이 수록될 예정이다. 이중 생존인물은 비교적 소수가 될 것으로 연구소는 전망하고 있다. 김책임연구원은 “우선 각국에 흩어진 친일인물관련 자료들을 모아 데이터베이스화하는 작업이 시급하다”며 “한 개인, 한 단체의 힘으로 할 수없는 작업인만큼 사회적 관심과 지원이 절실한 실정”이라고 밝혔다.","친일인명사전, 민족문제연구소, 친일파, 역사청산, 한국현대사","91년 창립이후 친일역사 청산문제를 지속적으로 연구해온 민족문제연구소 소장 김봉우 가 최근 친일인명사전 편찬계획을 공식발표 관련기사 본지 12일자, 일부지방 13일자 하면서 이 사전에 수록될 친일파 인물들의 면면에 관심이 쏠리고 있다.연구소는 사전발간을 지지하는 교수 1만명의 서명을 받은데 이어 앞으로 이 작업을 사회운동의 차원으로 발전시켜 나갈 계획이다. 연구소측이 1차로 선정한 인물은 1백명. 을사오적으로 불리는 권중현,박제순,이근택,이완용,이지용을 비롯해 일진회 회원이었던 송병준,이용구,윤갑병,윤시병 등이 명단에 포함돼있다. 민원식,박상준,박중양,석진형 등은 직업적 친일분자 로 분류돼있고 경찰·군인분야에는 박정희,백선엽,홍사익 등의 이름이 눈에 띈다. 일반인들의 관심이 가장 많이 쏠리는 분야는 사회·문화분야이다. 우리나라 최초의 신소설로 평가받는 혈 의 누 작가 이인직을 비롯해 유진오,백낙준,이병도,최남선 학술 ,김활란 여성 ,김동인,모윤숙,유치진,이광수 문학 ,김은호,이상범,현제명,홍난파 미술 음악 등이 친일인명사전 에 첫번째로 오를 예정이다. 연구소는 친일인물사전 이 20세기 한국사를 정리하고 21세기 새로운 도약을 위한 밑거름으로서 역사적 의미를 인정받는 것은 명확한 선정기준과 구체적인 증거자료를 기초로 한 평가작업에 달려 있다고 지적한다. 선정기준은 첫째 일제 식민체제에 어느정도 협력했는가, 둘째 광복이후 한국현대사에서 식민지배의 유산이 재생산되는 과정에서 어떤 역할을 했는가이다. 식민체제하에서 과연 친일파가 아닌 사람이 누가 있었겠는가라고 말하는 이도 있습니다. 물론 친일파로 알려진 분들 중에는 시대 분위기 속에서 마지못해 식민체제에 협조한 이도 있지요. 연구소가 이런 이들에 대해 단죄를 하자는 것이 결코 아니며 그럴 권리도 없습니다. 다만 객관적인 자료를 갖고 각 인물들의 친일행적을 정확하게 기록하려는 것 뿐입니다. 따라서 아무리 심증이 가는 친일파라 할지라도 구체적인 증거자료가 없을 경우에는 과감히 사전에서 제외될 겁니다. 김민철 책임연구원은 일제말기 20대 후반의 젊은 나이였던 박정희 전대통령은 비록 당시에는 사회 지도층이 아니었지만 만약 식민지배가 계속됐다면 적극 협력했을 것 이라며 그동안 후손들로부터 고소당하는 사건도 적지 않았고 갈등과 곤혹스러움을 느낄때도 있었지만 해방이후 현재까지 왜곡돼온 역사의식과 가치관을 바로잡는데 충실하겠다 고 말했다. 2002년 발간예정인 친일인명사전 은 백과사전 30권분량 규모. 자료수집비 40억 50억원, 출판비 30억원이 예상되는 방대한 작업이다. 구성은 1부 일제의 식민정책 및 이후 한국사회에 미친 영향 가제 , 2부 친일단체 활동내용 및 명부, 3부 친일인명사전으로 꾸며진다. 인명사전에는 최대 3천여명이 수록될 예정이다. 이중 생존인물은 비교적 소수가 될 것으로 연구소는 전망하고 있다. 김책임연구원은 우선 각국에 흩어진 친일인물관련 자료들을 모아 데이터베이스화하는 작업이 시급하다 며 한 개인, 한 단체의 힘으로 할 수없는 작업인만큼 사회적 관심과 지원이 절실한 실정 이라고 밝혔다.","91년 창립이후 친일역사 청산문제를 지속적으로 연구해온 민족문제연구소 소장 김봉우 가 최근 친일인명사전 편찬계획을 공식발표 관련기사 본지 12일자, 일부지방 13일자 하면서 이 사전에 수록될 친일파 인물들의 면면에 관심이 쏠리고 있다.연구소는 사전발간을 지지하는 교수 1만명의 서명을 받은데 이어 앞으로 이 작업을 사회운동의 차원으로 발전시켜 나갈 계획이다.
연구소측이 1차로 선정한 인물은 1백명.
을사오적으로 불리는 권중현,박제순,이근택,이완용,이지용을 비롯해 일진회 회원이었던 송병준,이용구,윤갑병,윤시병 등이 명단에 포함돼있다.
민원식,박상준,박중양,석진형 등은 직업적 친일분자 로 분류돼있고 경찰·군인분야에는 박정희,백선엽,홍사익 등의 이름이 눈에 띈다.
일반인들의 관심이 가장 많이 쏠리는 분야는 사회·문화분야이다.
우리나라 최초의 신소설로 평가받는 혈 의 누 작가 이인직을 비롯해 유진오,백낙준,이병도,최남선 학술 ,김활란 여성 ,김동인,모윤숙,유치진,이광수 문학 ,김은호,이상범,현제명,홍난파 미술 음악 등이 친일인명사전 에 첫번째로 오를 예정이다.
연구소는 친일인물사전 이 20세기 한국사를 정리하고 21세기 새로운 도약을 위한 밑거름으로서 역사적 의미를 인정받는 것은 명확한 선정기준과 구체적인 증거자료를 기초로 한 평가작업에 달려 있다고 지적한다.
선정기준은 첫째 일제 식민체제에 어느정도 협력했는가, 둘째 광복이후 한국현대사에서 식민지배의 유산이 재생산되는 과정에서 어떤 역할을 했는가이다.
식민체제하에서 과연 친일파가 아닌 사람이 누가 있었겠는가라고 말하는 이도 있습니다.
물론 친일파로 알려진 분들 중에는 시대 분위기 속에서 마지못해 식민체제에 협조한 이도 있지요.
연구소가 이런 이들에 대해 단죄를 하자는 것이 결코 아니며 그럴 권리도 없습니다.
다만 객관적인 자료를 갖고 각 인물들의 친일행적을 정확하게 기록하려는 것 뿐입니다.
따라서 아무리 심증이 가는 친일파라 할지라도 구체적인 증거자료가 없을 경우에는 과감히 사전에서 제외될 겁니다.
김민철 책임연구원은 일제말기 20대 후반의 젊은 나이였던 박정희 전대통령은 비록 당시에는 사회 지도층이 아니었지만 만약 식민지배가 계속됐다면 적극 협력했을 것 이라며 그동안 후손들로부터 고소당하는 사건도 적지 않았고 갈등과 곤혹스러움을 느낄때도 있었지만 해방이후 현재까지 왜곡돼온 역사의식과 가치관을 바로잡는데 충실하겠다 고 말했다.
2002년 발간예정인 친일인명사전 은 백과사전 30권분량 규모.
자료수집비 40억 50억원, 출판비 30억원이 예상되는 방대한 작업이다.
구성은 1부 일제의 식민정책 및 이후 한국사회에 미친 영향 가제 , 2부 친일단체 활동내용 및 명부, 3부 친일인명사전으로 꾸며진다.
인명사전에는 최대 3천여명이 수록될 예정이다.
이중 생존인물은 비교적 소수가 될 것으로 연구소는 전망하고 있다.
김책임연구원은 우선 각국에 흩어진 친일인물관련 자료들을 모아 데이터베이스화하는 작업이 시급하다 며 한 개인, 한 단체의 힘으로 할 수없는 작업인만큼 사회적 관심과 지원이 절실한 실정 이라고 밝혔다.","91년 창립 이후 친일 역사 청산 문제 지속 연구 해온 민족 문제 연구소 소장 김봉 최근 친일 인명 사전 편찬 계획 공식 발표 관련 기사 본지 12일 일부 지방 13일 하면서 사전 수록 친일파 인물 면면 관심 쏠리고 있다 연구소 발간 지지 하는 교수 1만 명의 서명 받은데 이어 작업 사회 운동 차원 발전 시켜 나갈 계획
연구소 차로 선정 인물
을사오적 불리는 권중현 박제순 이근택 이완용 이지용 비롯 일진회 회원 이었던 송병준 이용구 윤갑병 윤시병 명단 포함 돼있다
민원식 박상준 박중양 석진형 직업 친일 분자 분류 돼있고 경찰 군인 분야 에는 박정희 백선엽 홍사익 이름 띈다
일반인 관심 가장 많이 쏠리는 분야 사회 문화 분야
우리나라 최초 신소설 평가 받는 작가 이인직 비롯 유진오 백낙준 이병도 최남선 학술 김활란 여성 김동인 모윤숙 유치진 이광수 문학 김은호 이상범 현제명 홍난파 미술 음악 친일 인명 사전 번째 오를 예정
연구소 친일 인물사전 20 세기 한국사 정리 하고 21 세기 새로운 도약 밑거름 으로서 역사 의미 인정받는 명확한 선정 기준 구체 증거 자료 기초 평가 작업 달려 있다고 지적 한다
선정 기준 첫째 일제 식민 체제 어느 정도 협력 했는가 둘째 광복 이후 한국 대사 식민 지배 유산 재생산 되는 과정 어떤 역할 했는가이다
식민 체제 과연 친일파 아닌 사람 누가 있었겠는가라고 하는 이도 있습니다
물론 친일파 알려진 분들 에는 시대 분위기 마지못해 식민 체제 협조 이도 있지요
연구소 이런 대해 단죄 하자 결코 아니며 그럴 권리 없습니다
다만 객관 자료 갖고 인물 친일 행적 정확하게 기록 하려는 뿐입니다
따라서 아무리 심증 가는 친일파 할지라도 구체 증거 자료 없을 경우 에는 감히 사전 제외 겁니다
김민철 책임 연구원 일제 말기 20 후반 젊은 나이였던 박정희 전대통령 비록 당시 에는 사회 지도 아니었지만 만약 식민 지배 계속 됐다면 적극 협력 했을 라며 그동안 후손 로부터 고소 당하는 사건 적지 않았고 갈등 곤혹 스러 느낄 있었지만 해방 이후 현재 까지 왜곡 역사 의식 가치관 바로잡는데 충실하겠다 했다
2002년 발간 예정 친일 인명 사전 백과사전 30 분량 규모
자료 수집 40억 50억원 출판 30억원 예상 되는 방대한 작업
구성은 일제 식민정책 이후 한국 사회 미친 영향 가제 친일단체 활동 내용 명부 친일 인명 사전 꾸며진다
인명 사전 에는 최대 3천 여명이 수록 예정
이중 생존인물 비교 소수 연구소 전망 하고 있다
책임 연구원 우선 각국 흩어진 친일 인물 관련 자료 모아 데이터베이스 화하는 작업 시급하다 개인 단체 없는 작업 만큼 사회 관심 지원이 절실 실정 이라고 밝혔다"
