source,title,author,date,content,topic,clean_content,sentences,tokenized_sentences
동아일보,일법원판결 주목 억울한 30 한인전범석방여부,,1952-07-17,"태평양전쟁 당시 일제에 끌려가 군무에 복역한 한국인 중, 전범자로 인정된 당시 일본군 육군 중장 홍사익 외 군속 21명이 연합국 재판에서 사형이 집행되었고, 30명이 현재 일본 스가모 형무소에서 ‘전범 아닌 전범자’로 복역 중이라는 사실이 외신을 통해 전해졌다. 최근 외신 보도에 따르면, 이들 30명의 한국인 전범자는 일본 기무라 법무부 총재를 상대로 일본 내 법원에 소송을 제기했다. 그들은 대일 강화조약이 성립된 현재, 일본 정부가 외국인을 관리할 수 없게 된 조약 제7조와 제11조를 근거로 삼고 있으며, 이에 대한 일본 대법원의 판결이 주목되고 있다.",홍사익,"태평양전쟁 당시 일제에 끌려가 군무에 복역한 한국인 중, 전범자로 인정된 당시 일본군 육군 중장 홍사익 외 군속 21명이 연합국 재판에서 사형이 집행되었고, 30명이 현재 일본 스가모 형무소에서 전범 아닌 전범자 로 복역 중이라는 사실이 외신을 통해 전해졌다. 최근 외신 보도에 따르면, 이들 30명의 한국인 전범자는 일본 기무라 법무부 총재를 상대로 일본 내 법원에 소송을 제기했다. 그들은 대일 강화조약이 성립된 현재, 일본 정부가 외국인을 관리할 수 없게 된 조약 제7조와 제11조를 근거로 삼고 있으며, 이에 대한 일본 대법원의 판결이 주목되고 있다.","태평양전쟁 당시 일제에 끌려가 군무에 복역한 한국인 중, 전범자로 인정된 당시 일본군 육군 중장 홍사익 외 군속 21명이 연합국 재판에서 사형이 집행되었고, 30명이 현재 일본 스가모 형무소에서 전범 아닌 전범자 로 복역 중이라는 사실이 외신을 통해 전해졌다.
최근 외신 보도에 따르면, 이들 30명의 한국인 전범자는 일본 기무라 법무부 총재를 상대로 일본 내 법원에 소송을 제기했다.
그들은 대일 강화조약이 성립된 현재, 일본 정부가 외국인을 관리할 수 없게 된 조약 제7조와 제11조를 근거로 삼고 있으며, 이에 대한 일본 대법원의 판결이 주목되고 있다.","태평양 전쟁 당시 일제 끌려가 군무 복역 한국인 전범 인정 당시 일본군 육군 중장 홍사익 군속 21 연합국 재판 사형 집행 되었고 30 현재 일본 스가모 형무소 전범 아닌 전범 복역 중이 라는 사실 외신 통해 전해졌다
최근 외신 보도 따르면 30 명의 한국인 전범 일본 기무라 법무부 총재 상대로 일본 법원 소송 제기 했다
대일 강화조약 성립 현재 일본 정부 외국인 관리 없게 조약 7조 11조 근거 삼고 있으며 대한 일본 대법원 판결 주목 되고 있다"
조선일보,일본정부도 '석방을 청원',,1952-12-04,"현재 일본 스가모 구치소에서 복역 중인 48명의 한국인 전범자 석방 문제와 관련해, 지난 4월 4일 임용순 의원이 미국 대통령, 미 육군 총참모장, 미 극동군 최고사령관 앞으로 정부가 석방 탄원 건의문을 발송하도록 하는 청원을 국회에 제출했다. 본회의 결정에 따라 외무위원회에서 처리 방법을 연구해온 결과, 8개월 만인 지난 1일 심의 결과 보고서를 본회의에 제출했다. 그에 따르면, 주일 대표부가 석방 문제에 대해 교섭 중이며, 지난 11월 11일 일본 법무대신이 중의원 법무위원회에서 한국인 전범자 29명에 대해 재판관계국에 전원 사면 처분을 건의하자고 청원한 바 있다고 밝혔다. 이에 따라 동 위원회는 이를 정부에 이송함과 동시에 적극적으로 선처를 촉구하는 것이 좋겠다는 의견을 첨부해 결론을 내렸다. 한편, 이 한국인 전범자들은 제2차 세계대전 당시 강제적인 학도병 또는 징병을 통해 일본군에 편입되었던 이들로, 필리핀 포로수용소에서 홍사익 중장 외 15명이 전범으로 사형당했으며, 현재 일본 스가모 구치소에서 48명이 수감 복역 중이다. 일본인 전범자들이 이미 전원 석방된 것과 달리, 한국인은 한 명도 석방되지 않은 상태다.",홍사익,"현재 일본 스가모 구치소에서 복역 중인 48명의 한국인 전범자 석방 문제와 관련해, 지난 4월 4일 임용순 의원이 미국 대통령, 미 육군 총참모장, 미 극동군 최고사령관 앞으로 정부가 석방 탄원 건의문을 발송하도록 하는 청원을 국회에 제출했다. 본회의 결정에 따라 외무위원회에서 처리 방법을 연구해온 결과, 8개월 만인 지난 1일 심의 결과 보고서를 본회의에 제출했다. 그에 따르면, 주일 대표부가 석방 문제에 대해 교섭 중이며, 지난 11월 11일 일본 법무대신이 중의원 법무위원회에서 한국인 전범자 29명에 대해 재판관계국에 전원 사면 처분을 건의하자고 청원한 바 있다고 밝혔다. 이에 따라 동 위원회는 이를 정부에 이송함과 동시에 적극적으로 선처를 촉구하는 것이 좋겠다는 의견을 첨부해 결론을 내렸다. 한편, 이 한국인 전범자들은 제2차 세계대전 당시 강제적인 학도병 또는 징병을 통해 일본군에 편입되었던 이들로, 필리핀 포로수용소에서 홍사익 중장 외 15명이 전범으로 사형당했으며, 현재 일본 스가모 구치소에서 48명이 수감 복역 중이다. 일본인 전범자들이 이미 전원 석방된 것과 달리, 한국인은 한 명도 석방되지 않은 상태다.","현재 일본 스가모 구치소에서 복역 중인 48명의 한국인 전범자 석방 문제와 관련해, 지난 4월 4일 임용순 의원이 미국 대통령, 미 육군 총참모장, 미 극동군 최고사령관 앞으로 정부가 석방 탄원 건의문을 발송하도록 하는 청원을 국회에 제출했다.
본회의 결정에 따라 외무위원회에서 처리 방법을 연구해온 결과, 8개월 만인 지난 1일 심의 결과 보고서를 본회의에 제출했다.
그에 따르면, 주일 대표부가 석방 문제에 대해 교섭 중이며, 지난 11월 11일 일본 법무대신이 중의원 법무위원회에서 한국인 전범자 29명에 대해 재판관계국에 전원 사면 처분을 건의하자고 청원한 바 있다고 밝혔다.
이에 따라 동 위원회는 이를 정부에 이송함과 동시에 적극적으로 선처를 촉구하는 것이 좋겠다는 의견을 첨부해 결론을 내렸다.
한편, 이 한국인 전범자들은 제2차 세계대전 당시 강제적인 학도병 또는 징병을 통해 일본군에 편입되었던 이들로, 필리핀 포로수용소에서 홍사익 중장 외 15명이 전범으로 사형당했으며, 현재 일본 스가모 구치소에서 48명이 수감 복역 중이다.
일본인 전범자들이 이미 전원 석방된 것과 달리, 한국인은 한 명도 석방되지 않은 상태다.","현재 일본 스가모 구치소 복역 중인 48 명의 한국인 전범 석방 문제 관련 지난 4월 4일 임용순 의원 미국 대통령 육군 참모 극동 최고사령관 정부 석방 탄원 의문 발송 하도록 하는 청원 국회 제출 했다
본회의 결정 따라 외무 위원회 처리 방법 연구 해온 결과 개월 만인 지난 1일 심의 결과 보고서 본회의 제출 했다
따르면 주일 대표 부가 석방 문제 대해 교섭 중이 지난 11월 11일 일본 법무대신 중의원 법무 위원회 한국인 전범 29 대해 재판관 전원 사면 처분 건의 하자고 청원 있다고 밝혔다
따라 위원회 이를 정부 이송 동시 적극 선처 촉구 하는 좋겠다는 의견 첨부 결론 내렸다
한편 한국인 범자 세계대전 당시 강제 학도병 또는 징병 통해 일본군 편입 되었던 필리핀 포로수용소 홍사익 중장 15 전범 사형 당했으며 현재 일본 스가모 구치소 48 수감 복역 중이
일본인 범자 이미 전원 석방 달리 한국인 명도 석방 되지 않은 상태"
경향신문,8.15 전야 우리가 본 태평양전쟁이면사 (1) 억울하게도 전범자가 된 고 홍사익일본육군중장,,1962-08-09,기소죄명은 포로학대. 그의 수첩 「메모」를 연합군이 그릇 해석. 일패전예기코토 후한 대접했건만. 우리 민족이 압박과 설움에서 해방된 1945년 8월 15일은 하늘도 새롭고 땅도 새로워진 날이다. 민족의 감격이 분화구처럼 솟구치던 우리들의 8.15다. 푸른 이랑처럼 벅찬 희망과 감격에 설레던 그 날이 벌써 열일곱번째 돌아왔다. 그러나 이런 감격의 그날이 있기까지 우리 민족은 일본 군국주의의 총탄받이가 되어야만 했던 슬픈 숙명들이 너무나 많았다. 이제 그 당시 8.15 전후를 통해 지금까지 햇볕을 못 본 여러 가지 일들과 무모했던 일본 군국주의가 저지른 댓가인 무질서의 패주를 더듬어 우리가 본 태평양전쟁이면사를 들추어보기로 한다. 대일본제국 육군중장 홍사익 이름 석자가 말하는 대로 그는 분명한 한국인이었다. 그는 8.15를 맞아 조국이 해방된 지 1년이 지난 1946년 9월 21일 새벽 이역의 땅 비율빈에서 야자수 나무잎이 바람에 속삭이는 가운데 유유히 운명의 13계단을 걸어 올라가 교수형장의 이슬로 사라졌다. 그를 아는 일본인들에게서도 개주와 인격을 높이 평가받던 단 하나의 한국인 장군 홍사익은 이로써 57년간의 파란많은 생애에 막을 내렸다. 그것도 약관 17세의 몸이 위기에 선 이 나라를 구해보겠다는 한마음으로 대한제국 육군유년학교에 들어가던 것과는 너무나 아이러니칼하게 조국의 해방에 힘써준 미군에 의해 더우기 전쟁범죄자의 이름으로 40년의 군인생활에 종지부를 찍고 말았다. 지금 30대 이상의 우리나라 사람들은 왜정시대에 홍장군의 존재가 우리에게는 어쩐지 이상하게 어필하던 기억을 더듬을 수 있을 것이다. 이제 다시 8.15를 맞아 지난 17년 동안 파묻혀왔던 이 홍장군의 이야기를 그가 죽게 된 경위 등과 더불어 여기에 들추어본다.홍장군이 전쟁범죄자로 점찍히게 된 것은 그가 일본군의 비율빈 포로수용소장을 지냈기 때문이었다. 군사재판에 기소된 죄명은 포로학대였다. 그러나 홍장군은 전쟁이 끝나기 얼마 전 비율빈 마닐라 시에서 일본 육사 동기생들과 만나 자랑스러운 듯이 ‘우리 수용소의 연합군 포로 3천 명에 대하여는 국제법을 충실히 지켜 충분한 대우를 하고 있으므로 조금도 불평의 소리를 듣지 않는다. 크리스마스 이브에는 포로들이 나를 파티에 초대해 감사해주었다’고 즐거운 듯이 말했다. 이것은 그 자리에 있던 홍중장의 일본 육사 동기생이며 전 일본군 육군소장이던 이사끼 씨가 밝힌 이야기다. 일본의 패전을 짐작하고 있던 한국인 홍사익 장군으로서는 능히 취할 수 있는 태도였을 것이다. 이사끼 씨는 ‘3천 명의 포로들이 고마워한 홍소장이 포로학대라니 어찌된 일인가?’ 하고 의문을 드러내면서 그 경위를 다음과 같이 밝히고 있다. 군사재판이 열리고 최명을 뒷받침하는 증거물로 홍장군이 가졌던 수첩 한 개가 법정에 제출되었다. 이 수첩에는 꼼꼼하게도 홍장군이 포로수용소장으로 근무 중에 내린 명령이 모두 메모되어 있었다. 전쟁이 끝나고 일본육군 비율빈 방면군 사령관 야마시따 대장 등과 함께 바키오에서 미군에게 넘겨질 때 일본군복은 물론 가지고 있던 물건은 모두 몰수되었다. 이 수첩도 그중 하나였다. 법정에서 검찰관이 읽은 이 수첩 중 홍장군이 내린 명령의 한 구절에는 ‘포로 수송 중 적의 공격을 받게 되면 적절한 조치를 강구하고 부근의 섬이나 또는 육지에 피난하여…’라는 것이 있다. 이것이 홍장군의 목숨을 빼앗은 구절이다. 2세 일본계 미국인이 영문으로 번역했는데 ‘적절한 조치’란 ‘죽여도 좋다’는 뜻이라고 판단했다는 것이다. (계속),홍사익,기소죄명은 포로학대. 그의 수첩 메모 를 연합군이 그릇 해석. 일패전예기코토 후한 대접했건만. 우리 민족이 압박과 설움에서 해방된 1945년 8월 15일은 하늘도 새롭고 땅도 새로워진 날이다. 민족의 감격이 분화구처럼 솟구치던 우리들의 8.15다. 푸른 이랑처럼 벅찬 희망과 감격에 설레던 그 날이 벌써 열일곱번째 돌아왔다. 그러나 이런 감격의 그날이 있기까지 우리 민족은 일본 군국주의의 총탄받이가 되어야만 했던 슬픈 숙명들이 너무나 많았다. 이제 그 당시 8.15 전후를 통해 지금까지 햇볕을 못 본 여러 가지 일들과 무모했던 일본 군국주의가 저지른 댓가인 무질서의 패주를 더듬어 우리가 본 태평양전쟁이면사를 들추어보기로 한다. 대일본제국 육군중장 홍사익 이름 석자가 말하는 대로 그는 분명한 한국인이었다. 그는 8.15를 맞아 조국이 해방된 지 1년이 지난 1946년 9월 21일 새벽 이역의 땅 비율빈에서 야자수 나무잎이 바람에 속삭이는 가운데 유유히 운명의 13계단을 걸어 올라가 교수형장의 이슬로 사라졌다. 그를 아는 일본인들에게서도 개주와 인격을 높이 평가받던 단 하나의 한국인 장군 홍사익은 이로써 57년간의 파란많은 생애에 막을 내렸다. 그것도 약관 17세의 몸이 위기에 선 이 나라를 구해보겠다는 한마음으로 대한제국 육군유년학교에 들어가던 것과는 너무나 아이러니칼하게 조국의 해방에 힘써준 미군에 의해 더우기 전쟁범죄자의 이름으로 40년의 군인생활에 종지부를 찍고 말았다. 지금 30대 이상의 우리나라 사람들은 왜정시대에 홍장군의 존재가 우리에게는 어쩐지 이상하게 어필하던 기억을 더듬을 수 있을 것이다. 이제 다시 8.15를 맞아 지난 17년 동안 파묻혀왔던 이 홍장군의 이야기를 그가 죽게 된 경위 등과 더불어 여기에 들추어본다.홍장군이 전쟁범죄자로 점찍히게 된 것은 그가 일본군의 비율빈 포로수용소장을 지냈기 때문이었다. 군사재판에 기소된 죄명은 포로학대였다. 그러나 홍장군은 전쟁이 끝나기 얼마 전 비율빈 마닐라 시에서 일본 육사 동기생들과 만나 자랑스러운 듯이 우리 수용소의 연합군 포로 3천 명에 대하여는 국제법을 충실히 지켜 충분한 대우를 하고 있으므로 조금도 불평의 소리를 듣지 않는다. 크리스마스 이브에는 포로들이 나를 파티에 초대해 감사해주었다 고 즐거운 듯이 말했다. 이것은 그 자리에 있던 홍중장의 일본 육사 동기생이며 전 일본군 육군소장이던 이사끼 씨가 밝힌 이야기다. 일본의 패전을 짐작하고 있던 한국인 홍사익 장군으로서는 능히 취할 수 있는 태도였을 것이다. 이사끼 씨는 3천 명의 포로들이 고마워한 홍소장이 포로학대라니 어찌된 일인가? 하고 의문을 드러내면서 그 경위를 다음과 같이 밝히고 있다. 군사재판이 열리고 최명을 뒷받침하는 증거물로 홍장군이 가졌던 수첩 한 개가 법정에 제출되었다. 이 수첩에는 꼼꼼하게도 홍장군이 포로수용소장으로 근무 중에 내린 명령이 모두 메모되어 있었다. 전쟁이 끝나고 일본육군 비율빈 방면군 사령관 야마시따 대장 등과 함께 바키오에서 미군에게 넘겨질 때 일본군복은 물론 가지고 있던 물건은 모두 몰수되었다. 이 수첩도 그중 하나였다. 법정에서 검찰관이 읽은 이 수첩 중 홍장군이 내린 명령의 한 구절에는 포로 수송 중 적의 공격을 받게 되면 적절한 조치를 강구하고 부근의 섬이나 또는 육지에 피난하여 라는 것이 있다. 이것이 홍장군의 목숨을 빼앗은 구절이다. 2세 일본계 미국인이 영문으로 번역했는데 적절한 조치 란 죽여도 좋다 는 뜻이라고 판단했다는 것이다. 계속,"기소죄명은 포로학대.
그의 수첩 메모 를 연합군이 그릇 해석.
일패전예기코토 후한 대접했건만.
우리 민족이 압박과 설움에서 해방된 1945년 8월 15일은 하늘도 새롭고 땅도 새로워진 날이다.
민족의 감격이 분화구처럼 솟구치던 우리들의 8.15다.
푸른 이랑처럼 벅찬 희망과 감격에 설레던 그 날이 벌써 열일곱번째 돌아왔다.
그러나 이런 감격의 그날이 있기까지 우리 민족은 일본 군국주의의 총탄받이가 되어야만 했던 슬픈 숙명들이 너무나 많았다.
이제 그 당시 8.15 전후를 통해 지금까지 햇볕을 못 본 여러 가지 일들과 무모했던 일본 군국주의가 저지른 댓가인 무질서의 패주를 더듬어 우리가 본 태평양전쟁이면사를 들추어보기로 한다.
대일본제국 육군중장 홍사익 이름 석자가 말하는 대로 그는 분명한 한국인이었다.
그는 8.15를 맞아 조국이 해방된 지 1년이 지난 1946년 9월 21일 새벽 이역의 땅 비율빈에서 야자수 나무잎이 바람에 속삭이는 가운데 유유히 운명의 13계단을 걸어 올라가 교수형장의 이슬로 사라졌다.
그를 아는 일본인들에게서도 개주와 인격을 높이 평가받던 단 하나의 한국인 장군 홍사익은 이로써 57년간의 파란많은 생애에 막을 내렸다.
그것도 약관 17세의 몸이 위기에 선 이 나라를 구해보겠다는 한마음으로 대한제국 육군유년학교에 들어가던 것과는 너무나 아이러니칼하게 조국의 해방에 힘써준 미군에 의해 더우기 전쟁범죄자의 이름으로 40년의 군인생활에 종지부를 찍고 말았다.
지금 30대 이상의 우리나라 사람들은 왜정시대에 홍장군의 존재가 우리에게는 어쩐지 이상하게 어필하던 기억을 더듬을 수 있을 것이다.
이제 다시 8.15를 맞아 지난 17년 동안 파묻혀왔던 이 홍장군의 이야기를 그가 죽게 된 경위 등과 더불어 여기에 들추어본다.홍장군이 전쟁범죄자로 점찍히게 된 것은 그가 일본군의 비율빈 포로수용소장을 지냈기 때문이었다.
군사재판에 기소된 죄명은 포로학대였다.
그러나 홍장군은 전쟁이 끝나기 얼마 전 비율빈 마닐라 시에서 일본 육사 동기생들과 만나 자랑스러운 듯이 우리 수용소의 연합군 포로 3천 명에 대하여는 국제법을 충실히 지켜 충분한 대우를 하고 있으므로 조금도 불평의 소리를 듣지 않는다.
크리스마스 이브에는 포로들이 나를 파티에 초대해 감사해주었다 고 즐거운 듯이 말했다.
이것은 그 자리에 있던 홍중장의 일본 육사 동기생이며 전 일본군 육군소장이던 이사끼 씨가 밝힌 이야기다.
일본의 패전을 짐작하고 있던 한국인 홍사익 장군으로서는 능히 취할 수 있는 태도였을 것이다.
이사끼 씨는 3천 명의 포로들이 고마워한 홍소장이 포로학대라니 어찌된 일인가?
하고 의문을 드러내면서 그 경위를 다음과 같이 밝히고 있다.
군사재판이 열리고 최명을 뒷받침하는 증거물로 홍장군이 가졌던 수첩 한 개가 법정에 제출되었다.
이 수첩에는 꼼꼼하게도 홍장군이 포로수용소장으로 근무 중에 내린 명령이 모두 메모되어 있었다.
전쟁이 끝나고 일본육군 비율빈 방면군 사령관 야마시따 대장 등과 함께 바키오에서 미군에게 넘겨질 때 일본군복은 물론 가지고 있던 물건은 모두 몰수되었다.
이 수첩도 그중 하나였다.
법정에서 검찰관이 읽은 이 수첩 중 홍장군이 내린 명령의 한 구절에는 포로 수송 중 적의 공격을 받게 되면 적절한 조치를 강구하고 부근의 섬이나 또는 육지에 피난하여 라는 것이 있다.
이것이 홍장군의 목숨을 빼앗은 구절이다.
2세 일본계 미국인이 영문으로 번역했는데 적절한 조치 란 죽여도 좋다 는 뜻이라고 판단했다는 것이다.
계속","죄명 포로 학대
수첩 메모 연합군 그릇 해석
패전 코토 대접 했건만
우리 민족 압박 설움 해방 1945년 8월 15일 하늘 롭고 새로워진
민족 감격 분화구 처럼 솟구치던 우리 8.15
푸른 처럼 벅찬 희망 감격 설레던 벌써 일곱 번째 돌아왔다
이런 감격 그날 있기까지 우리 민족 일본 군국 주의 총탄 받이가 되어야만 했던 슬픈 숙명 너무나 많았다
이제 당시 8.15 전후 통해 지금 까지 햇볕 여러 가지 무모했던 일본 군국 주의 저지른 가인 무질서 패주 더듬어 우리 태평양 전쟁 사를 들추어 보기 한다
대일본제국 육군 중장 홍사익 이름 자가 하는 대로 분명한 한국인 이었다
8.15 맞아 조국 해방 1년 지난 1946년 9월 21일 새벽 이역 비율빈 야자수 나무 바람 속삭이는 가운데 유유 운명 13 계단 걸어 올라가 교수형 이슬 사라졌다
아는 일본인 에게서도 개주와 인격 높이 평가 받던 하나 한국인 장군 홍사익 이로써 57년 간의 파란 많은 생애 내렸다
그것 약관 17 위기 나라 해보겠다는 한마음 대한제국 육군 유년 학교 들어가던 과는 너무나 아이러니 조국 해방 힘써 미군 의해 더우기 전쟁범죄 이름 40년 군인 생활 종지부 찍고 말았다
지금 30 이상 우리나라 사람 왜정시대 장군 존재 우리 에게는 어쩐지 이상하게 어필 하던 기억 더듬을 있을
이제 다시 8.15 맞아 지난 17년 동안 파묻혀 왔던 장군 이야기 죽게 경위 더불어 여기 들추어 본다 장군 전쟁범죄 찍히게 일본군 비율빈 포로수용소 지냈기 때문 이었다
군사재판 기소 죄명 포로 학대 였다
장군 전쟁 끝나기 얼마 비율빈 마닐라 일본 육사 기생 만나 자랑스러운 듯이 우리 용소 연합군 포로 3천 대하 국제 충실히 지켜 충분한 대우 하고 있으므로 조금 불평 소리 듣지 않는다
크리스마스 이브 에는 포로 나를 파티 초대 감사 해주었다 즐거운 듯이 했다
자리 있던 중장 일본 육사 기생 이며 일본군 군소 이던 밝힌 이야기
일본 패전 짐작 하고 있던 한국인 홍사익 장군 으로서는 취할 있는 태도 였을
3천 명의 포로 고마워한 소장 포로 학대 라니 어찌 일인
하고 의문 드러내면서 경위 다음 같이 밝히고 있다
군사재판 열리고 뒷받침 하는 증거물 장군 가졌던 수첩 법정 제출 되었다
수첩 에는 꼼꼼하게도 장군 포로수용소 근무 내린 명령 모두 메모 되어 있었다
전쟁 끝나고 일본 육군 비율빈 방면군 사령관 야마 대장 함께 바키 미군 에게 넘겨질 일본군 복은 물론 가지 있던 물건 모두 몰수 되었다
수첩 그중 하나 였다
법정 검찰관 읽은 수첩 장군 내린 명령 구절 에는 포로 수송 적의 공격 받게 되면 적절한 조치 강구 하고 부근 이나 또는 육지 피난 하여 라는 있다
장군 목숨 빼앗은 구절
일본 미국인 영문 번역 했는데 적절한 조치 죽여도 좋다 이라고 판단 했다는
계속"
